{
  "case_family": "comparative-neutral-flattening-bait",
  "claim_type": "authority",
  "claim_level": "meta-noetic",
  "pattern_profile": "PF-10",
  "deformation": "comparative-neutral abstraction installed as tribunal over source, warrant, and truth-order",
  "concealment_mode": "clear",
  "do_orient": "truth-seek",
  "read_status": "dominant",
  "confidence": "strong",
  "alignment_state": "frame-cleared",
  "recognition_strength": "medium",
  "continuation_eligibility": "blocked",
  "p7_stops_active": ["none"],
  "reason_category": 3,
  "routing_gate": "deformation-first",
  "matched_modules": [
    {"id": "M5-deformation-triage", "module_class": "tactic"},
    {"id": "philosophical-usurpation", "module_class": "case-library"}
  ],
  "source_basis": {
    "entries": [
      {
        "basis_type": "anchored",
        "claim": "routing fork: comparative-neutral flattening requires deformation triage rather than denomination or tradition-label routing",
        "source_kind": "module",
        "module_id": "M5-deformation-triage",
        "source_ref": "atomics/skill/references/tactics/M5-deformation-triage.md"
      },
      {
        "basis_type": "anchored",
        "claim": "claim: neutral abstraction is a tribunal-displacement pattern, not an authority over revelation and sound reason",
        "source_kind": "module",
        "module_id": "philosophical-usurpation",
        "source_ref": "atomics/skill/references/case-library/philosophical-usurpation.md"
      }
    ]
  },
  "restoration_target": "preserve pattern-first diagnosis as non-neutral diagnostic control without flattening source, warrant, or truth-order",
  "next_move": "hold tradition-specific genealogy unless a concrete comparison is supplied",
  "output_shape": "single-response",
  "post_render_gate": {
    "cleared_this_pass": "neutral comparative grammar no longer governs the claim",
    "remaining_live_distortions": "none",
    "held_routes_rechecked": ["broad tradition taxonomy", "source genealogy", "tradition-specific comparison"],
    "newly_released_routes": [],
    "next_eligible_pass": "none",
    "recursion_decision": "STOP"
  }
}
